{
  "authority": "independent-advanced-llm-reviewer",
  "decided_at": "2026-07-24T01:38:53Z",
  "decision": "approved_for_implementation",
  "micro_spec_id": "ms-0003-008",
  "micro_spec_path": ".specbound/micro-specs/req-0003/ms-0003-008.md",
  "micro_spec_sha256": "8ffac441e4dba9a255dbf4f55ad0011eb2944ece133d0b6a1e9c73f458c08984",
  "permitted_next_action": "implement_bound_micro_spec_only",
  "reason": "Manual-bootstrap exception explicitly approved by the accountable user because reviewer-agent role separation is not yet operational. This exact digest-bound decision authorizes only AC-008 repository-local guidance and behavioral-evidence implementation; actual independence is unproven and remains an audit limitation. It authorizes no live publication, adoption, merge, delivery, or release.",
  "requirement_id": "req-0003",
  "requirement_path": ".specbound/requirements/req-0003/req-0003-r2.md",
  "requirement_sha256": "e8e3833e7e1b559bd0ed862cfd13b95a7fd2aadce92b89a9aac8df6b135fc354",
  "revision": 2,
  "risk": "high",
  "schema_version": 1
}
