{
  "authority": "independent-advanced-llm-reviewer",
  "decided_at": "2026-07-24T01:21:43Z",
  "decision": "approved_for_implementation",
  "micro_spec_id": "ms-0003-006",
  "micro_spec_path": ".specbound/micro-specs/req-0003/ms-0003-006.md",
  "micro_spec_sha256": "de589fe2d4616ac99e50dcb4eadb2d92e39a4c76d18f4845679bb48dc0d5d411",
  "permitted_next_action": "implement_bound_micro_spec_only",
  "reason": "Manual-bootstrap exception explicitly approved by the accountable user because the reviewer-agent layout is not yet operational. This exact digest-bound decision authorizes only AC-006 failure-atomic copied-fixture publication implementation; actual independent role separation is unproven and remains an audit limitation. It authorizes no production adoption, live issuance, AC-007+, merge, delivery, or release.",
  "requirement_id": "req-0003",
  "requirement_path": ".specbound/requirements/req-0003/req-0003-r2.md",
  "requirement_sha256": "e8e3833e7e1b559bd0ed862cfd13b95a7fd2aadce92b89a9aac8df6b135fc354",
  "revision": 2,
  "risk": "high",
  "schema_version": 1
}
