{
  "authority": "independent-advanced-llm-reviewer",
  "decided_at": "2026-07-28T00:52:42Z",
  "decision": "approved_for_implementation",
  "micro_spec_id": "ms-0005-001",
  "micro_spec_path": ".specbound/micro-specs/req-0005/ms-0005-001.md",
  "micro_spec_sha256": "ecf2bc92a740c30540c14c805a63b664079b3b9b5ff4ed4db72843808766fb6d",
  "permitted_next_action": "implement_bound_micro_spec_only",
  "reason": "Fresh-context exact-byte review passed for req-0005-r1 AC-001 and AC-002 completion group CG-1; parent binding, closed schema and authority contracts, deterministic Git-history eligibility and effective-state semantics, mutation boundaries, platform gates, and non-goals were found implementation-ready with no remaining blocker.",
  "requirement_id": "req-0005",
  "requirement_path": ".specbound/requirements/req-0005/req-0005-r1.md",
  "requirement_sha256": "fa483adbf3155a138aaa7507faa96b7a0997c06df0ee645013fbaf7dcad8a545",
  "revision": 1,
  "risk": "high",
  "schema_version": 1
}
