{
  "authority": "fixture-maintainer",
  "decided_at": "2026-01-01T00:00:00Z",
  "decision": "approved_for_implementation",
  "micro_spec_id": "ms-9005-001",
  "micro_spec_path": ".specbound/micro-specs/req-9005/ms-9005-001.md",
  "micro_spec_sha256": "00b5af7477c3ffb6ed612542ebd710730e30736d1c3b95e7365aa5b332b251c4",
  "permitted_next_action": "implement_bound_micro_spec_only",
  "reason": "Exact fixture review permits only this bound implementation.",
  "requirement_id": "req-9005",
  "requirement_path": ".specbound/requirements/req-9005/req-9005-r1.md",
  "requirement_sha256": "4018a05c125b2bc59c379779266dfb2992d22c3e48dad3eca5b16ef18e616a87",
  "revision": 1,
  "risk": "high",
  "schema_version": 1
}
