{
  "authority": "fixture-maintainer",
  "decided_at": "2026-01-01T00:00:00Z",
  "decision": "approved_for_implementation",
  "micro_spec_id": "ms-9006-001",
  "micro_spec_path": ".specbound/micro-specs/req-9006/ms-9006-001.md",
  "micro_spec_sha256": "87fcf8c7410e56dc182cd43270837e0deebc0e54438a02cfc4571f6c1b2f7a39",
  "permitted_next_action": "implement_bound_micro_spec_only",
  "reason": "Exact fixture review permits only this bound implementation.",
  "requirement_id": "req-9006",
  "requirement_path": ".specbound/requirements/req-9006/req-9006-r1.md",
  "requirement_sha256": "d1292c059b77fa28c9a2b05ba5799f62bcfe90a1486abd7f8b0cdb27c4344b84",
  "revision": 1,
  "risk": "high",
  "schema_version": 1
}
