{
  "authority": "independent-advanced-llm-reviewer",
  "decided_at": "2026-07-24T00:57:24Z",
  "decision": "approved_for_implementation",
  "micro_spec_id": "ms-0003-004",
  "micro_spec_path": ".specbound/micro-specs/req-0003/ms-0003-004.md",
  "micro_spec_sha256": "603b6654b00d4f73004858c8eef08e8ab0e4548b24199a6d4ca08021e11db156",
  "permitted_next_action": "implement_bound_micro_spec_only",
  "reason": "Manual-bootstrap exception: the accountable user explicitly authorized this narrow AC-004 implementation gate pending a later Discovery for independent reviewer-agent topology; this record does not establish actual reviewer independence.",
  "requirement_id": "req-0003",
  "requirement_path": ".specbound/requirements/req-0003/req-0003-r2.md",
  "requirement_sha256": "e8e3833e7e1b559bd0ed862cfd13b95a7fd2aadce92b89a9aac8df6b135fc354",
  "revision": 2,
  "risk": "high",
  "schema_version": 1
}
