{
  "authority": "independent-advanced-llm-reviewer",
  "decided_at": "2026-07-24T00:39:39Z",
  "decision": "approved_for_implementation",
  "micro_spec_id": "ms-0003-003",
  "micro_spec_path": ".specbound/micro-specs/req-0003/ms-0003-003.md",
  "micro_spec_sha256": "da28a5c1380a90a38a36c7f621563d3f3fb1b16cd00789bcd0892d09970a64d4",
  "permitted_next_action": "implement_bound_micro_spec_only",
  "reason": "Manual-bootstrap exception: the accountable user explicitly authorized this narrow AC-003 implementation gate pending a later Discovery for independent reviewer-agent topology; this record does not establish actual reviewer independence.",
  "requirement_id": "req-0003",
  "requirement_path": "docs/requirements/req-0003/req-0003-r2.md",
  "requirement_sha256": "2c0f5c42a68a7ded6ba8f95fca19cc657986867a928a945a9c969dfba93d28fe",
  "revision": 2,
  "risk": "high",
  "schema_version": 1
}
