{
  "authority": "independent-advanced-llm-reviewer",
  "decided_at": "2026-07-24T01:29:38Z",
  "decision": "approved_for_implementation",
  "micro_spec_id": "ms-0003-007",
  "micro_spec_path": ".specbound/micro-specs/req-0003/ms-0003-007.md",
  "micro_spec_sha256": "d303214dab376fa2765ee7df52533d5af4f7f70ddc312b1aeac31cac3ebe078c",
  "permitted_next_action": "implement_bound_micro_spec_only",
  "reason": "Manual-bootstrap exception explicitly approved by the accountable user because reviewer-agent role separation is not yet operational. This exact digest-bound decision authorizes only AC-007 structured copied-fixture publication result implementation; actual independence is unproven and remains an audit limitation. It authorizes no production adoption, live issuance, AC-008, merge, delivery, or release.",
  "requirement_id": "req-0003",
  "requirement_path": "docs/requirements/req-0003/req-0003-r2.md",
  "requirement_sha256": "2c0f5c42a68a7ded6ba8f95fca19cc657986867a928a945a9c969dfba93d28fe",
  "revision": 2,
  "risk": "high",
  "schema_version": 1
}
